{
  "id": "web:languages",
  "title": "Languages",
  "description": "Get started with commonly-used language configurations: Pug/HTML, SCSS/Less/Saas and JS/TS.",
  "templates": [
    {
      "title": "HTML w/Less + JavaScript",
      "files": [
        {
          "filename": "index.html"
        },
        {
          "filename": "script.js"
        },
        {
          "filename": "style.less"
        }
      ]
    },
    {
      "title": "HTML w/Less + TypeScript",
      "files": [
        {
          "filename": "index.html"
        },
        {
          "filename": "script.ts"
        },
        {
          "filename": "style.less"
        }
      ]
    },
    {
      "title": "HTML w/Sass + JavaScript",
      "files": [
        {
          "filename": "index.html"
        },
        {
          "filename": "script.js"
        },
        {
          "filename": "style.sass"
        }
      ]
    },
    {
      "title": "HTML w/Sass + TypeScript",
      "files": [
        {
          "filename": "index.html"
        },
        {
          "filename": "script.ts"
        },
        {
          "filename": "style.sass"
        }
      ]
    },
    {
      "title": "HTML w/SCSS + JavaScript",
      "files": [
        {
          "filename": "index.html"
        },
        {
          "filename": "script.js"
        },
        {
          "filename": "style.scss"
        }
      ]
    },
    {
      "title": "HTML w/SCSS + TypeScript",
      "files": [
        {
          "filename": "index.html"
        },
        {
          "filename": "script.ts"
        },
        {
          "filename": "style.scss"
        }
      ]
    },
    {
      "title": "Pug w/Less + TypeScript",
      "files": [
        {
          "filename": "index.pug"
        },
        {
          "filename": "script.ts"
        },
        {
          "filename": "style.less"
        }
      ]
    },
    {
      "title": "Pug w/Less + JavaScript",
      "files": [
        {
          "filename": "index.pug"
        },
        {
          "filename": "script.js"
        },
        {
          "filename": "style.less"
        }
      ]
    },
    {
      "title": "Pug w/Sass + JavaScript",
      "files": [
        {
          "filename": "index.pug"
        },
        {
          "filename": "script.js"
        },
        {
          "filename": "style.sass"
        }
      ]
    },
    {
      "title": "Pug w/Sass + TypeScript",
      "files": [
        {
          "filename": "index.pug"
        },
        {
          "filename": "script.ts"
        },
        {
          "filename": "style.sass"
        }
      ]
    },
    {
      "title": "Pug w/SCSS + JavaScript",
      "files": [
        {
          "filename": "index.pug"
        },
        {
          "filename": "script.js"
        },
        {
          "filename": "style.scss"
        }
      ]
    },
    {
      "title": "Pug w/SCSS + TypeScript",
      "files": [
        {
          "filename": "index.pug"
        },
        {
          "filename": "script.ts"
        },
        {
          "filename": "style.scss"
        }
      ]
    },
    {
      "title": "HTML + Angular (TypeScript)",
      "files": [
        {
          "filename": "index.html",
          "content": "<app-root></app-root>"
        },
        {
          "filename": "app.component.ts",
          "content": "import { Component } from '@angular/core';\n\n@Component({\n  selector: 'app-root',\n  template: `\n    <div style=\"text-align: center; padding: 2rem;\">\n      <h1>Hello {{ name }}!</h1>\n      <button (click)=\"name = 'Angular'\">Click me</button>\n    </div>\n  `\n})\nexport class AppComponent {\n  name = 'world';\n}"
        }
      ]
    },
    {
      "title": "HTML + Angular Standalone",
      "files": [
        {
          "filename": "index.html",
          "content": "<app-root></app-root>"
        },
        {
          "filename": "app.component.ts",
          "content": "import { Component } from '@angular/core';\nimport { CommonModule } from '@angular/common';\nimport { FormsModule } from '@angular/forms';\n\n@Component({\n  selector: 'app-root',\n  standalone: true,\n  imports: [CommonModule, FormsModule],\n  template: `\n    <div style=\"text-align: center; padding: 2rem;\">\n      <h1>Hello {{ name }}!</h1>\n      <input [(ngModel)]=\"name\" placeholder=\"Enter name\" />\n    </div>\n  `\n})\nexport class AppComponent {\n  name = 'world';\n}"
        }
      ]
    }
  ]
}