{
  "id": "web:components",
  "title": "Components",
  "description": "Create components using popular libraries and frameworks.",
  "templates": [
    {
      "title": "React.js",
      "files": [
        {
          "filename": "App.jsx",
          "content": "export default function App() {\n   return <div>Hello world</div>;\n}"
        }
      ]
    },
    {
      "title": "React.js w/TypeScript",
      "files": [
        {
          "filename": "App.tsx",
          "content": "export default function App() {\n   return <div>Hello world</div>;\n}"
        }
      ]
    },
    {
      "title": "React Native",
      "files": [
        {
          "filename": "App.jsx",
          "content": "import { StyleSheet, Text, View } from \"react-native\";\n\nexport default function App() {\n   return (\n      <View>\n         <Text style={styles.text}>Hello world 🎉</Text>\n      </View>\n   );\n}\n\nconst styles = StyleSheet.create({\n   text: {\n      fontWeight: \"bold\",\n      fontSize: \"1.5rem\",\n      marginVertical: \"1em\",\n      textAlign: \"center\"\n   }\n});"
        }
      ]
    },
    {
      "title": "Vue.js",
      "files": [
        {
          "filename": "App.vue",
          "content": "<template>\n  <p>{{ greeting }} World!</p>\n</template>\n\n<script>\nexport default {\n  data() {\n    return {\n      greeting: 'Hello'\n    }\n  }\n}\n</script>\n\n<style>\nbody {\n  font-family: sans-serif;\n}\n</style>\n\n"
        }
      ]
    },
    {
      "title": "Svelte",
      "files": [
        {
          "filename": "App.svelte",
          "content": "<script>\nlet name = \"world\";\n</script>\n\n<h1>Hello {name}!</h1>"
        }
      ]
    },
    {
      "title": "Svelte w/TypeScript",
      "files": [
        {
          "filename": "App.svelte",
          "content": "<script lang=\"ts\">\nlet name: string = \"world\";\n</script>\n\n<h1>Hello {name}!</h1>"
        }
      ]
    },
    {
      "title": "Angular",
      "files": [
        {
          "filename": "app.component.ts",
          "content": "import { Component } from '@angular/core';\n\n@Component({\n  selector: 'app-root',\n  template: `\n    <div style=\"text-align: center; padding: 2rem;\">\n      <h1>Hello {{ name }}!</h1>\n      <button (click)=\"name = 'Angular'\">Click me</button>\n    </div>\n  `,\n  styles: [`\n    :host {\n      font-family: -apple-system, BlinkMacSystemFont, 'Segoe UI', Roboto, Oxygen, Ubuntu, Cantarell, sans-serif;\n    }\n  `]\n})\nexport class AppComponent {\n  name = 'world';\n}"
        }
      ]
    },
    {
      "title": "Angular w/Standalone",
      "files": [
        {
          "filename": "app.component.ts",
          "content": "import { Component } from '@angular/core';\nimport { CommonModule } from '@angular/common';\nimport { FormsModule } from '@angular/forms';\n\n@Component({\n  selector: 'app-root',\n  standalone: true,\n  imports: [CommonModule, FormsModule],\n  template: `\n    <div style=\"text-align: center; padding: 2rem;\">\n      <h1>Hello {{ name }}!</h1>\n      <input [(ngModel)]=\"name\" placeholder=\"Enter name\" />\n      <button (click)=\"reset()\">Reset</button>\n    </div>\n  `,\n  styles: [`\n    :host {\n      font-family: -apple-system, BlinkMacSystemFont, 'Segoe UI', Roboto, Oxygen, Ubuntu, Cantarell, sans-serif;\n    }\n    input {\n      padding: 0.5rem;\n      margin: 0 0.5rem;\n      border: 1px solid #ccc;\n      border-radius: 4px;\n    }\n    button {\n      padding: 0.5rem 1rem;\n      background-color: #007bff;\n      color: white;\n      border: none;\n      border-radius: 4px;\n      cursor: pointer;\n    }\n    button:hover {\n      background-color: #0056b3;\n    }\n  `]\n})\nexport class AppComponent {\n  name = 'world';\n  \n  reset() {\n    this.name = 'world';\n  }\n}"
        }
      ]
    }
  ]
}